ingredient,first_sentences
castoreum,Castoreum is safe in usual food amounts and seems to be safe for most people when applied directly to the  skin.
catechu,Catechu is  LIKELY SAFE  when taken in amounts found in food.
catnip,Catnip is  POSSIBLY SAFE  for most adults when taken by mouth in small amounts.
cats-claw,"Cat's claw is  POSSIBLY SAFE  for most people, when taken by mouth short-term."
cats-foot,There isn’t enough information to know if cat’s foot is safe.
catuaba,There isn't enough information available to know if catuaba is safe.
cauliflower,Cauliflower is  LIKELY SAFE  when consumed in food amounts.
celery,Celery oil and celery seeds are  LIKELY SAFE  when taken by mouth in food amounts.
centaury,Centaury is safe when used in food amounts and seems safe for most people when used in medicinal amounts.
cereus,"Cereus seems safe for most people, when used for conditions other than  heart disease."
cesium,High doses of cesium might be  UNSAFE.
cetylated-fatty-acids,"Cetylated fatty acids are  POSSIBLY SAFE  when taken by mouth or applied to the skin, short-term."
ceylon-cinnamon,Consuming Ceylon cinnamon in food amounts is  LIKELY SAFE.
cha-de-bugre,There is not enough known about Cha de Bugre to know if there are any safety concerns or if it is safe to take.
chaga,It isn’t known if chaga is safe or what the possible side effects might be.
chanca-piedra,Chanca piedra is  POSSIBLY SAFE  when taken by mouth for a short time period (up to 3 months).
chaparral,Chaparral is  UNSAFE.
chaulmoogra,Chaulmoogra is  UNSAFE  when taken by  mouth  because it contains cyanide and might cause cyanide poisoning.
cheken,There isn't enough information available to know if cheken is safe or what the possible side effects might be.
chelated-minerals,There isn't enough information available to know if chelated minerals are safe.
chenopodium-oil,Chenopodium oil is  UNSAFE.
cherokee-rosehip,Cherokee rosehip appears to be safe for most people when taken at recommended doses.
cherry-laurel-water,Cherry laurel water seems safe for use when used in small amounts (up to about 1.
chervil,Chervil and chervil extracts are  LIKELY SAFE  in food amounts.
chia,Chia is  POSSIBLY SAFE  when taken by mouth for up to 12 weeks and when applied to the skin for up to 8 weeks.
chickweed,"Chickweed is  LIKELY SAFE  for most adults when taken by  mouth , but the potential side effects are not known."
chicory,Chicory is  LIKELY SAFE  for most adults when consumed in amounts found in food.
chinese-club-moss,There isn't enough information available to know if Chinese club moss is safe.
chinese-cucumber,Chinese cucumber ROOT is  UNSAFE.
chinese-mallow,There isn't enough information available to know if Chinese mallow is safe.
chinese-prickly-ash,There isn’t enough information to know if Chinese prickly ash is safe for use as a medicine.
chirata,Chirata is  LIKELY SAFE  when taken by  mouth  in the amounts found in beverages.
chitosan,Chitosan is  POSSIBLY SAFE  for most people when taken by mouth for up to 6 months or when applied to the skin for a short time.
chive,Chive is  LIKELY SAFE  for most people in food amounts.
chlorella,"Chlorella is  LIKELY SAFE  when taken by mouth, short-term (up to 29 weeks)."
chlorophyll,Chlorophyll is  LIKELY SAFE  for most people when taken by  mouth.
chlorophyllin,Chlorophyllin seems to be safe for most people.
choline,Choline is  LIKELY SAFE  for most adults when taken by mouth or given intravenously (by IV) in appropriate amounts.
chondroitin-sulfate,Chondroitin sulfate is  LIKELY SAFE  when taken by mouth or used as an eye solution during cataract surgery.
chromium,"Chromium is  LIKELY SAFE  for most adults when taken by mouth in medicinal amounts, short-term."
chrysanthemum,There isn't enough information to know if chrysanthemum is safe.
chrysin,Chrysin is  POSSIBLY SAFE  for most adults when taken by  mouth  for up to 8 weeks.
chuchuhuasi,It isn’t known if chuchuhuasi is safe or what the possible side effects might be.
chymotrypsin,Chymotrypsin is safe when used in the  eye  by a  healthcare  professional.
ciguatoxins,Ciguatoxins are  UNSAFE  when taken by mouth.
cilantro,Cilantro is  LIKELY SAFE  when taken by mouth in food amounts.
cinchona,Cinchona is  LIKELY SAFE  when used as a flavoring in tonic water and alcoholic beverages.
cissus-quadrangularis,Cissus quadrangularis is  POSSIBLY SAFE  when taken by mouth appropriately short-term (for up to 6-10 weeks).
citicoline,Citicoline is  POSSIBLY SAFE  when taken by mouth short-term (up to 90 days).
citronella-oil,Citronella oil seems to be safe for most people in the small amounts found in foods.
civet,Civet is safe for most people when used in the amounts found in foods.
clary-sage,Clary sage is safe when used in amounts found in foods.
clay,A type of clay known as  calcium  montmorillonite (NovaSil) is  POSSIBLY SAFE  when taken by  mouth  for a short period of time.
clematis,Fresh clematis is  UNSAFE  to take by  mouth.
clivers,Clivers is  POSSIBLY SAFE  for most people when taken appropriately by  mouth.
clove,Clove is  LIKELY SAFE  for most people when taken by mouth in amounts commonly found in food.
clowns-mustard-plant,Clown's mustard plant seems to be safe for most people when used for up to eight weeks.
club-moss,Club moss is  POSSIBLY UNSAFE  when taken by  mouth  because it contains several poisonous chemicals.
cnidium,There is not enough information about cnidium to know if it is safe.
coca,Coca leaf without the cocaine (decocainized) is  LIKELY SAFE  for most people when used in normal food amounts.
cocillana,There isn't enough information to know if cocillana is safe or what the possible side effects might be.
cocoa,Eating cocoa is  LIKELY SAFE  for most people.
coconut,Coconut is  LIKELY SAFE  when eaten in food amounts.
coconut-oil,Coconut oil is  LIKELY SAFE  when applied to the skin.
coconut-water,Coconut water is  LIKELY SAFE  for most adults when consumed as a drink.
cod-liver-oil,Cod liver oil is  LIKELY SAFE  for most adults and children when taken by mouth.
codonopsis,Codonopsis is  POSSIBLY SAFE  for most people when taken by  mouth  in appropriate amounts.
coenzyme-q10,Coenzyme Q10 is  LIKELY SAFE  for most adults when taken by mouth or when applied directly to the gums.
coffee,Coffee is safe for most adults.
coffee-charcoal,Coffee charcoal seems to be safe for most people.
cola-nut,Cola nut is  LIKELY SAFE  for most people when consumed in amounts found in foods.
coleus,"Coleus is  POSSIBLY SAFE  for most adults when given intravenously (by IV), when inhaled (breathed in), or when applied as eye drops."
collagen-type-ii,Collagen type II is  POSSIBLY SAFE  when taken by mouth in doses up to 2.
collard,Collard is  LIKELY SAFE  when consumed in food amounts.
colloidal-minerals,Colloidal minerals is  POSSIBLY UNSAFE  for use.
colloidal-silver,"Colloidal silver is  LIKELY UNSAFE  when taken by mouth, applied to the skin, or injected intravenously (by IV)."
colocynth,Colocynth is  UNSAFE  for use.
colombo,There isn't enough information available to know if colombo is safe.
coltsfoot,Coltsfoot is considered  UNSAFE.
columbine,There isn't enough information to know if columbine is safe for use as a medicine or what the possible side effects might be.
comfrey,Comfrey is  POSSIBLY SAFE  for most people when applied to unbroken skin in small amounts for less than 10 days.
common-stonecrop,There isn't enough information to know if common stonecrop is safe for use as a medicine.
condurango,Condurango seems safe for most people when used appropriately.
conjugated-linoleic-acid,Conjugated linoleic acid is  LIKELY SAFE  when taken by mouth in amounts found in foods and is  POSSIBLY SAFE  when taken by mouth in medicinal amounts (larger amounts than those found in food).
contrayerva,Contrayerva might be  UNSAFE  for use.
coolwort,There isn't enough information to know if coolwort is safe or what the side effects might be.
copaiba-balsam,Copaiba balsam is safe for most people in normal food amounts.
copper,Copper is  LIKELY SAFE  when taken by mouth in amounts no greater than 10 mg daily.
coral,Coral is  LIKELY SAFE  for most people when used in surgery as a bone substitute.
coral-root,There isn't enough information to know if coral root is safe for use as a medicine or what the possible side effects might be.
cordyceps,"Cordyceps is  POSSIBLY SAFE  for most people when taken appropriately by mouth, short-term."
coriander,Coriander is  LIKELY SAFE  in food amounts and  POSSIBLY SAFE  for most people when taken by mouth in appropriate medicinal amounts.
coriolus-mushroom,Coriolus mushroom is  LIKELY SAFE  for most people when taken by mouth appropriately.
corkwood-tree,Corkwood tree is  UNSAFE  when taken by  mouth.
corn-cockle,Corn cockle is  UNSAFE  to take by  mouth.
corn-poppy,Dried corn poppy flowers are  POSSIBLY SAFE  for most adults to take by  mouth  as a medicine.
corn-silk,Corn silk seems to be safe for most people.
cornflower,Cornflower is  LIKELY SAFE  when used to color herbal teas.
corydalis,It is not known if using corydalis is safe.
costus,Costus oil is  LIKELY SAFE  for most people when taken by  mouth  in amounts found in foods.
cotton,Cotton is  POSSIBLY SAFE  for most people when taken by  mouth  as a medicine or when cotton root bark preparations are taken in amounts found in foods.
couch-grass,It isn't known if couch grass is safe or what the possible side effects might be.
cowhage,"A powdered preparation of cowhage seed, called Zandopa (formerly HP-200; Zandu Pharmaceuticals), is  POSSIBLY SAFE  for most people when taken by mouth for up to 20 weeks."
cowslip,"Cowslip is  POSSIBLY SAFE  for most people when taken by mouth in small amounts as part of combination products containing gentian root, European elder flower, verbena, and sorrel (SinuComp, Sinupret, Sinupret +) or when taken as part of a combination product containing cowslip and thyme (Bronchipret)."
cramp-bark,There isn't enough information to know if cramp bark is safe.
cranberry,Cranberry is  LIKELY SAFE  for most people when taken by mouth appropriately.
creatine,Creatine  is  LIKELY SAFE  when taken by mouth at doses up to 25 grams daily for up to 14 days.
croton-seeds,Croton seeds are  UNSAFE  when taken by  mouth  or put on the skin.
cubebs,"Cubebs seems to be safe for most people when taken by  mouth , but the possible side effects are not known."
cudweed,It is not known if cudweed is safe or what the potential side effects might be.
cumin,Cumin is  LIKELY SAFE  when taken by  mouth  in food amounts and  POSSIBLY SAFE  when taken by  mouth.
cup-plant,It is not known if cup plant is safe or what the possible side effects might be.
cupmoss,It is not known if cupmoss is safe or what the possible side effects might be.
cyclamen,Cyclamen is  UNSAFE  for use.
cypress,It is not known if cypress is safe.
cypress-spurge,Cypress spurge is  UNSAFE.
daffodil,Daffodil is  UNSAFE  for use.
damiana,Damiana is  LIKELY SAFE  when taken by  mouth  in amounts commonly found in foods.
dandelion,Dandelion is  LIKELY SAFE  for most people when used in the amounts commonly found in food.
danshen,Danshen is  POSSIBLY SAFE  when taken by mouth by most people.
date-palm,Dates are  LIKELY SAFE  for most people when taken in food amounts.
datura-wrightii,Datura wrightii is  LIKELY UNSAFE  when taken by  mouth.
deanol,Deanol is  POSSIBLY SAFE  for most people when taken by mouth or applied to the skin.
deer-velvet,Deer velvet is  POSSIBLY SAFE  when taken by mouth for up to 12 weeks.
deertongue,Deertongue is  UNSAFE  for use.
delphinium,Delphinium is  UNSAFE  for use as a medicine.
dendrobium,There isn't enough information to know if dendrobium is safe or what side effects it might cause.
desert-parsley,There isn’t enough reliable information to know whether desert parsley is safe.
devils-claw,Devil's claw is  POSSIBLY SAFE  for most adults when taken by mouth in appropriate doses for up to a year.
devils-club,There isn't enough information to know if devil's club is safe or what the possible side effects might be.
dha-docosahexaenoic-acid,DHA is  LIKELY SAFE  for most people when taken by mouth.
dhea,"DHEA is  POSSIBLY SAFE  when taken by mouth, applied to the skin, and used inside the vagina appropriately."
diacylglycerol,Diacylglycerol appears to be safe for most people.
diatomaceous-earth,There isn't enough reliable information available to know if diatomaceous earth is safe or what the side effects might be.
dibencozide,Dibencozide seems to be safe for most people.
diindolylmethane,Diindolylmethane is  LIKELY SAFE  when consumed in the small amounts found in foods.
diiodothyronine,There isn't enough information to know if diiodothyronine is safe.
dill,Dill is  LIKELY SAFE  when consumed as a food.
dimethylamylamine,Dimethylamylamine is  LIKELY UNSAFE  when taken by mouth.
dimethylglycine,"Dimethylglycine is  POSSIBLY SAFE  when used short-term, for up to 28 days."
diosmin,Diosmin is safe for most people when used short-term for up to 6 months.
divi-divi,There isn't enough information to know if divi-divi is safe or what the possible side effects might be.
d-mannose,D-mannose is  POSSIBLY SAFE  for most adults when taken by mouth.
dmso-dimethylsulfoxide,DMSO is  LIKELY SAFE  when used as a prescription medication.
dodder,There isn't enough information available to know if dodder is safe.
dolomite,Dolomite is  POSSIBLY UNSAFE  for most adults when taken by  mouth.
dong-quai,Dong quai is  POSSIBLY SAFE  for adults when taken by mouth or when occasionally applied to the skin as a cream.
dragons-blood,Dragon's blood appears to be safe for most adults when taken by  mouth.
duckweed,There isn't enough information available to know if duckweed is safe or what the possible side effects might be.
durian,It is not known if durian is safe.
dusty-miller,Dusty miller can be  UNSAFE  for people to use.
dwarf-elder,Using dwarf elder in large amounts is  UNSAFE.
dwarf-pine-needle,Dwarf pine needle oil is safe for most people when used in amounts typically found in foods.
dyers-broom,Dyer's broom might be  UNSAFE  when taken by  mouth.
eastern-hemlock,It is not known if eastern hemlock is safe or what the possible side effects might be.
eastern-red-cedar,There is not enough information to know if Eastern red cedar is safe.
ecdysterone,There isn't enough reliable information available about ecdysterone to know if it is safe.
echinacea,Echinacea is  LIKELY SAFE  for most people when taken by mouth in the short-term.
edta,"EDTA is safe when used as a prescription medicine, as eye drops, and in small amounts as a preservative in foods."
elderberry,Elderberry fruit extract is  POSSIBLY SAFE  when taken by mouth for up to 12 weeks.
elderflower,Elderflower is  LIKELY SAFE  when used in amounts found in foods.
elecampane,Elecampane is  POSSIBLY SAFE  for most adults when taken by mouth in usual medicinal amounts.
elemi,Elemi is safe for most people in the amounts found in foods.
ellagic-acid,"Ellagic acid is  POSSIBLY SAFE  when taken by mouth or applied to the skin, short-term."
elm-bark,There isn’t enough information available to know if elm bark is safe.
emu-oil,Emu oil is possibly safe for most people when applied to the skin in appropriate amounts for up to 6 weeks.
english-adders-tongue,There isn't enough information to know whether English adder's tongue is safe or what the side effects might be.
english-horsemint,There isn't enough information available to know if English horsemint is safe or what the possible side effects might be.
english-ivy,Cough syrup  (Prospan; Panoto-s; Athos; Abrilar) containing English ivy leaf extract is  POSSIBLY SAFE  when taken by  mouth  three times daily for 1 week.
english-walnut,English walnut nut is safe for most people in usual food amounts.
epa-eicosapentaenoic-acid,EPA is  LIKELY SAFE  for most people when taken appropriately.
ephedra,Do not take products that contain ephedra or its active ingredients. Ephedra is  LIKELY UNSAFE  for adults and children.
equol,Taking equol  supplements  is  LIKELY SAFE  when used for up to one year.
ergot,Ergot is  UNSAFE.
ergothioneine,Ergothioneine is  LIKELY SAFE  when used in amounts found in foods.
eryngo,There isn’t enough information available to know if eryngo is safe or what the side effects might be.
eucalyptus,Eucalyptus leaf is LIKELY SAFE  when consumed in the small amounts found in foods.
euphorbia,There isn't enough information available to know if euphorbia is safe.
european-barberry,The fruit of European barberry is  LIKELY SAFE  when consumed in food amounts.
european-buckthorn,"European buckthorn is  POSSIBLY SAFE  for adults when standardized preparations are used short-term, up to 8-10 days."
european-chestnut,European chestnut seems safe for most adults when taken by  mouth.
european-five-finger-grass,There isn't enough information available to know if European five-finger grass is safe or what the possible side effects might be.
european-mandrake,European mandrake is  POSSIBLY UNSAFE  and should be avoided.
european-mistletoe,European mistletoe is  POSSIBLY SAFE  when used by mouth or when injected beneath the skin in appropriate amounts.
eurycoma-longifolia,Eurycoma longifolia is  POSSIBLY SAFE  when taken by mouth in medicinal amounts for up to 9 months.
evening-primrose-oil,Evening primrose oil is  LIKELY SAFE  for most people when used for up to a year.
evodia,There is not enough information available to know if evodia is safe or what the possible side effects might be.
eyebright,Eyebright is  POSSIBLY SAFE  for most people when taken by mouth.
fadogia-agrestis,There isn’t enough information available to know if Fadogia agrestis is safe or what the possible side effects might be.
false-unicorn,False unicorn seems to be safe for most adults.
fennel,Fennel is  LIKELY SAFE  when taken by mouth in the amounts commonly found in food.
fenugreek,Fenugreek is  LIKELY SAFE  for people when taken by mouth in amounts normally found in foods.
fermented-milk,Fermented milk is  LIKELY SAFE  when taking by mouth in amounts commonly found in foods.
fermented-wheat-germ-extract,Fermented wheat germ extract is  POSSIBLY SAFE  when taken by  mouth  in medicinal amounts.
fever-bark,Fever bark seems to be  UNSAFE.
feverfew,Feverfew is  LIKELY SAFE  when taken by mouth appropriately in the short-term (up to four months).
ficin,There isn't enough information to know if ficin is safe to take by  mouth.
field-scabious,There isn't enough information to know if field scabious is safe for use as medicine or what the possible side effects might be.
fig,Fresh or dried fig fruit is  LIKELY SAFE  for most people when used in food amounts.
figwort,There isn't enough information to know if figwort is safe.
fir,Fir might be safe for most people.
fireweed,Fireweed seems to be safe for most adults.
fish-oil,Fish oil is  LIKELY SAFE  for most people when taken by mouth in low doses (3 grams or less per day).
flaxseed,Flaxseed is  LIKELY SAFE  for most adults when taken by mouth.
flaxseed-oil,Flaxseed oil is  LIKELY SAFE  for most adults when taken by mouth appropriately short-term.
fluoride,"Fluoride is safe for most people in the amounts added to public water supplies and used in toothpastes and mouthwashes, and applied by dentists."
folic-acid,Folic acid is  LIKELY SAFE  for most people when taken by mouth or injected into the body.
fools-parsley,Fool's parsley is  UNSAFE.
forget-me-not,Forget-me-not might be  UNSAFE.
forsythia,It is not known if forsythia is safe when taken by  mouth.
fo-ti,Fo-ti is  POSSIBLY UNSAFE  to take by mouth due to concerns that it might cause liver damage in both adults and children.
foxglove,Foxglove is  UNSAFE  for anyone to take by mouth without the advice and care of a  healthcare  professional.
frankincense,Frankincense seems safe for use by most adults.
freshcut,There isn't enough reliable information available about freshcut to know if it is safe or what the side effects might be.
fringetree,There isn’t enough information to know if fringetree is safe.
frostwort,There isn't enough information to know if frostwort is safe or what the possible side effects might be.
fructo-oligosaccharides,Fructo-oligosaccharides seem to be safe when taken in less than 30 grams per day.
fulvic-acid,There isn’t enough reliable information about fulvic acid to know if it is safe.
fumitory,Fumitory is  POSSIBLY SAFE  for most adults when taken by  mouth  in the recommended amounts for a short period of time.
gaba-gamma-aminobutyric-acid,"GABA is  LIKELY SAFE  when taken correctly by mouth for short periods of time, up to 12 weeks."
galacto-oligosaccharides,Galacto-oligosaccharides are  POSSIBLY SAFE  when taken in doses of less than 20 grams per day.
galbanum,Galbanum seems safe for use when applied directly to the skin.
galphimia-glauca,"Galphimia glauca is  LIKELY SAFE  when taken by  mouth  in homeopathic (diluted) amounts, short-term."
gamboge,Gamboge seems to be  UNSAFE.
gamma-butyrolactone-gbl,Gamma butyrolactone (GBL) is  UNSAFE.
gamma-linolenic-acid,Gamma linolenic acid is  POSSIBLY SAFE  for most adults when taken by mouth in amounts of no more than 2.
gamma-oryzanol,Gamma oryzanol is  POSSIBLY SAFE  for most adults when taken by mouth or applied to the skin.
gamma-hydroxybutyrate,The prescription medication GHB (sodium oxybate) is  POSSIBLY SAFE  for adults who are taking it under close medical supervision for symptoms of a condition called narcolepsy.
garcinia,Garcinia is  POSSIBLY UNSAFE  when taken by mouth.
garden-cress,There isn't enough information to know whether garden cress is safe to use as a medicine.
gardenia,It isn't known if gardenia is safe when taken by mouth or applied to the skin.
garlic,Garlic is  LIKELY SAFE  for most people when taken by mouth appropriately.
gelatin,Gelatin is  LIKELY SAFE  for most people in food amounts.
gelsemium,Gelsemium is  UNSAFE.
genistein-combined-polysaccharide,There isn't enough information to know if genistein combined polysaccharide is safe.
gentian,"Gentian seems to be safe for most people when taken by mouth in small amounts as part of a combination product containing gentian root, elderflower, verbena, and cowslip flower (SinuComp, Sinupret)."
german-chamomile,German chamomile is  LIKELY SAFE  when taken in amounts found in food.
german-ipecac,German ipecac might be  UNSAFE  to take by  mouth.
german-sarsaparilla,There isn't enough information to know whether German sarsaparilla is safe.
germander,Germander is  UNSAFE.
germanium,Germanium is  LIKELY SAFE  when taken by mouth in amounts normally found in the diet.
ginger,Ginger is  LIKELY SAFE  when taken by mouth appropriately.
ginkgo,Ginkgo LEAF EXTRACT is  LIKELY SAFE  for most people when taken by mouth in appropriate doses.
ginseng-siberian,"Siberian ginseng is  LIKELY SAFE  for most adults when taken by mouth, short-term."
globe-flower,Fresh globe flower plant is  UNSAFE.
globemallow,It is not known if globemallow is safe or what the potential side effects might be.
glossy-privet,Glossy privet might be safe for most adults when used appropriately.
glucomannan,Glucomannan powder or flour is  LIKELY SAFE  when consumed as food.
glucosamine-hydrochloride,Glucosamine hydrochloride is  POSSIBLY SAFE  for most adults when taken by mouth appropriately for up to 2 years.
glucosamine-sulfate,Glucosamine sulfate is  LIKELY SAFE  when used appropriately by mouth in adults.
glutamine,Glutamine is  LIKELY SAFE  for most adults when taken by mouth in doses up to 40 grams daily or when given intravenously (by IV) in doses up to 600 mg/kg of body weight daily.
glutathione,"Glutathione is  POSSIBLY SAFE  for most adults when taken by mouth, by inhalation, or by injection into the muscle or into the veins."
glycerol,Glycerol seems to be safe for most adults.
glycine,Glycine is  POSSIBLY SAFE  for most people when taken by mouth or applied to the skin.
glycomacropeptide,Glycomacropeptide is  POSSIBLY SAFE  when taken by mouth as a food supplement for up to one year.
glyconutrients,Glyconutrients are  POSSIBLY SAFE  when taken by mouth in a dose of about 9 grams per day for 7 weeks.
goa-powder,Goa powder might be  UNSAFE.
goats-rue,There isn't enough information to know whether goat's rue is safe.
goji,"Goji is  POSSIBLY SAFE  when taken appropriately by mouth, short-term."
golden-ragwort,"There’s a lot of concern about using golden ragwort as medicine, because it contains chemicals called hepatotoxic pyrrolizidine alkaloids (PAs), which may block  blood  flow in the veins and cause  liver  damage. Hepatotoxic PAs might also cause  cancer  and  birth defects."
goldenrod,There is not enough information available to know if goldenrod is safe to take for medical conditions.
goldenseal,Goldenseal is  POSSIBLY SAFE  for most adults when taken by mouth as a single dose.
goldthread,There is not enough information to know if goldthread is safe in medicinal amounts.
gossypol,Gossypol is  POSSIBLY UNSAFE  for use without close supervision by a  healthcare  professional.
gotu-kola,Gotu kola is  POSSIBLY SAFE  in pregnant women when applied to the skin.
goutweed,There isn't enough information to know if goutweed is safe or what the possible side effects might be.
grains-of-paradise,Grains of paradise might be safe for most adults.
grape,Grape is  LIKELY SAFE  when consumed in amounts commonly found in foods.
grapefruit,Grapefruit is  LIKELY SAFE  in the amounts normally used as food and  POSSIBLY SAFE  when taken by mouth for medicinal purposes.
gravel-root,"There’s a lot of concern about using gravel root as medicine, because it contains chemicals called hepatotoxic pyrrolizidine alkaloids (PAs), which may block  blood  flow in the veins and cause  liver  damage. Hepatotoxic PAs might also cause  cancer  and  birth defects."
graviola,Graviola is  POSSIBLY UNSAFE  when taken by mouth.
great-plantain,Great plantain seems to be safe when taken by  mouth  by most adults.
