ingredient,first_sentences
greater-bindweed,Greater bindweed may be  UNSAFE  due to its strong  laxative  effects.
greater-burnet,It is not known if greater burnet is safe or what the possible side effects might be.
greater-celandine,Greater celandine is  POSSIBLY UNSAFE  when taken by mouth.
greek-sage,It is not known if Greek sage is safe or what the possible side effects might be.
green-coffee,Green coffee is  POSSIBLY SAFE  when taken by mouth appropriately.
green-tea,"Green tea is  LIKELY SAFE  for most adults when consumed as a drink in moderate amounts or when green tea extract is applied to the skin as a specific ointment (Veregen, Bradley Pharmaceuticals), short-term."
ground-ivy,Ground ivy is  POSSIBLY SAFE  in the amounts used to flavor foods and in small doses as medicine.
ground-pine,It isn’t known if ground pine is safe for use as a medicine or what the possible side effects might be.
groundsel,Groundsel is  LIKELY UNSAFE  for anyone to take by mouth.
guaiac-wood,Guaiac wood and guaiac resin seem to be safe for most adults in the amounts found in foods and in small medicinal doses.
guar-gum,Guar gum is  LIKELY SAFE  for most people when taken by mouth with at least 8 ounces of liquid.
guarana,Guarana is  LIKELY SAFE  for most adults when consumed in amounts commonly found in foods.
guarumo,Guarumo is  POSSIBLY SAFE  when taken by  mouth  as a tea.
guava,Guava fruit is  LIKELY SAFE  when eaten as a food.
guayule,It isn’t known if guayule is safe or what the possible side effects might be.
guggul,Guggul is  POSSIBLY SAFE  for most people when taken by mouth appropriately.
gumweed,Gumweed is  POSSIBLY SAFE  for most people when taken by  mouth.
gymnema,Gymnema is  POSSIBLY SAFE  when taken by mouth appropriately for up to 20 months.
haronga,Haronga might be safe for most people if used for a short time.
hartstongue,There isn't enough information available to know if hartstongue is safe or what the possible side effects might be.
hawaiian-baby-woodrose,Hawaiian baby woodrose is  UNSAFE.
hawthorn,Hawthorn is  POSSIBLY SAFE  for most adults when used at recommended doses short-term (up to 16 weeks).
hazelnut,Hazelnut seems to be safe for most people in food amounts.
hearts-ease,Heart 's ease is  POSSIBLY SAFE  for most people when taken appropriately by  mouth  or applied to the skin.
heather,"Heather might be safe for most people, but the possible side effects are not known."
hedge-mustard,The flowering above-ground parts of hedge mustard are considered  UNSAFE  to take by  mouth.
hedge-hyssop,Hedge-hyssop is considered to be  UNSAFE.
hemlock,"All parts of hemlock, including seeds, flowers, and fruits, are  UNSAFE."
hemlock-spruce,It is not known if hemlock spruce is safe or what the potential side effects might be.
hemlock-water-dropwort,Hemlock water dropwort is  UNSAFE  and poisonous.
hemp-agrimony,"There’s a lot of concern about using hemp agrimony as medicine, because it contains chemicals called hepatotoxic pyrrolizidine alkaloids (PAs), which may block  blood  flow in the veins and cause  liver  damage. Hepatotoxic PAs might also cause  cancer  and  birth defects."
hempnettle,"Hempnettle seems to be safe for most people when taken by  mouth , but the possible side effects are not known."
henbane,Henbane is possibly safe for most people when taken by mouth for a short time with the help of a  healthcare  professional.
henna,Henna seems to be safe for most adults when used on the skin or hair.
herb-paris,Herb Paris is  UNSAFE  when taken by  mouth.
herb-robert,There isn't enough information available to know if Herb Robert is safe.
hericium-erinaceus,"Hericium erinaceus is  POSSIBLY SAFE   when taken by mouth as a medicine, short-term."
hesperidin,Hesperidin is  POSSIBLY SAFE  for most people when taken by mouth for up to 6 months.
hibiscus,Hibiscus is  LIKELY SAFE  for most people in when consumed in food amounts.
higenamine,Higenamine is  POSSIBLY UNSAFE  when taken by mouth.
histidine,Histidine might be safe for most people.
holly,Holly BERRIES are poisonous and  UNSAFE  for use.
hollyhock,"Hollyhock might be safe for most people, but the possible side effects aren't known."
holy-basil,"Holy basil is  POSSIBLY SAFE  when used by mouth for short periods of time, up to six weeks."
homotaurine,Homotaurine is  POSSIBLY SAFE  when taken by  mouth  for most people.
honey,Honey is  LIKELY SAFE  for most adults and children over one year old when taken by mouth or when appropriately applied to the skin by adults.
honeysuckle,"It is not known if honeysuckle, in general, is safe."
hoodia,There isn’t enough information to know if hoodia is safe.
hops,Hops are considered  LIKELY SAFE  when consumed in amounts commonly found in foods.
hordenine,Hordenine is  POSSIBLY UNSAFE  when taken by mouth.
horny-goat-weed,"Horny goat weed extract is  POSSIBLY SAFE  when taken by mouth, appropriately."
horse-chestnut,Horse chestnut is  LIKELY SAFE  for most people when a standardized seed extract product is taken by mouth for a short amount of time.
horsemint,It isn’t known if horsemint is safe or what the possible side effects might be.
horseradish,Horseradish root is  LIKELY SAFE  when taken by mouth in food amounts.
horsetail,Horsetail is  POSSIBLY UNSAFE  when taken by mouth long-term.
hounds-tongue,Hound's tongue is  UNSAFE  and poisonous.
houseleek,There isn't enough information to know if houseleek is safe when taken by mouth or put on the skin or what the possible side effects might be.
hu-zhang,There is not enough information available to know if hu zhang is safe to take for medical conditions.
humic-acid,There isn’t enough information available to know if humic acid is safe.
huperzine-a,Huperzine A is  POSSIBLY SAFE  when taken by mouth for a short period of time (less than 3 months).
hyacinth-bean,Hyacinth beans are  POSSIBLY UNSAFE  when eaten raw and in large amounts.
hyaluronic-acid,"Hyaluronic acid is  LIKELY SAFE  when taken by mouth, applied to the skin, or given by injection and appropriately."
hydrangea,Hydrangea is  POSSIBLY SAFE  for most people when taken by  mouth  for only a few days.
hydrazine-sulfate,Hydrazine sulfate is  POSSIBLY UNSAFE.
hydroxycitric-acid,Hydroxycitric acid is  POSSIBLY SAFE  for most people when taken by  mouth  for 12 weeks or less.
hydroxymethylbutyrate,"HMB is  POSSIBLY SAFE  for most people when taken by mouth, short-term."
hyperimmune-egg,Hyperimmune egg seems to be safe for adults when used appropriately up to 26 weeks.
hyssop,Hyssop is considered safe for most people in the amounts commonly found in foods and in medicinal amounts.
iboga,There isn’t enough information to know if iboga is safe for use.
iceland-moss,Iceland moss seems safe for most people when taken short-term.
idebenone,Idebenone is  POSSIBLY SAFE  for most people when taken by mouth and when used on the skin.
ignatius-bean,Ignatius bean is  UNSAFE.
immortelle,There isn't enough information to know if immortelle is safe.
indian-frankincense,Indian frankincense is  LIKELY SAFE  for most adults when taken by mouth for up to six months.
indian-gooseberry,Indian gooseberry seems  LIKELY SAFE  for most people when consumed in amounts found in foods.
indian-long-pepper,There isn't enough information to know if Indian long pepper is safe for use as a medicine.
indian-physic,It is not known if Indian physic is safe or what the possible side effects might be.
indian-snakeroot,Indian snakeroot is  POSSIBLY SAFE  when taken by mouth.
indium,Indium might be  UNSAFE.
indole-3-carbinol,Indole-3-carbinol is  POSSIBLY SAFE  for most people when taken by mouth as a medicine under proper medical supervision.
inosine,Inosine is  POSSIBLY SAFE  for most people when taken by mouth.
inositol,Inositol is  POSSIBLY SAFE  for most adults when taken by mouth.
inositol-nicotinate,Inositol nicotinate is  POSSIBLY SAFE  for most people when taken by mouth.
iodine,Iodine is  LIKELY SAFE  for most people when taken by mouth at recommended amounts or when applied to the skin appropriately using approved products.
ip-6,IP-6 is safe when used in amounts found in foods.
ipecac,Ipecac is  POSSIBLY SAFE  for most people when taken by mouth and used for a short time.
iporuru,It is not known if iporuru is safe or what the possible side effects might be.
ipriflavone,Ipriflavone is  LIKELY SAFE  for most people when used with proper medical supervision.
iron,Iron is  LIKELY SAFE  for most people when it is taken by mouth or injected into the vein in appropriate amounts.
irvingia-gabonensis,"Irvingia gabonensis is  POSSIBLY SAFE  for adults when a crude seed extract is taken for up to 4 weeks, or when a specific standardized seed extract called IGOB131 is used for up to 10 weeks."
isatis,"Isatis is  POSSIBLY SAFE  when applied to the skin appropriately, short-term."
ivy-gourd,Ivy gourd is  POSSIBLY SAFE  for most people when taken by  mouth  for up to 6 weeks.
jaborandi,Jaborandi is  UNSAFE  for use as a medicinal herb.
jackfruit,It isn't known if jackfruit is safe when taken as a medicine.
jacobs-ladder,It is not known if Jacob's ladder is safe or what the possible side effects might be.
jalap,Jalap is  UNSAFE.
jamaican-dogwood,Jamaican dogwood is  LIKELY UNSAFE  and poisonous when taken by  mouth  for self-medication.
jambolan,Jambolan is  POSSIBLY SAFE  for most people when taken by mouth in usual medicinal amounts.
japanese-apricot,The processed fruit seems to be safe in food amounts.
japanese-mint,Japanese mint oil seems to be safe for most people when taken appropriately by mouth or applied to the skin.
japanese-persimmon,There isn't enough information available to know if Japanese persimmon is safe for medicinal use.
jasmine,Jasmine is  LIKELY SAFE  for most people in food amounts.
java-tea,Java tea is  POSSIBLY SAFE  when taken by mouth by adults for a short period of time.
javanese-turmeric,"Javanese turmeric seems to be safe for most people when used for a short time, up to 18 weeks."
jequirity,Jequirity is  LIKELY UNSAFE  when taken by mouth.
jewelweed,Jewelweed is  POSSIBLY SAFE  for most people when taken by  mouth  or applied directly to the skin.
jiaogulan,Jiaogulan is  POSSIBLY SAFE  when taken by mouth short-term (up to 4 months).
jimson-weed,Jimson weed is  UNSAFE  when taken by mouth or inhaled.
jobs-tears,Job's tears seems to be safe when in food amounts.
jojoba,Jojoba is  LIKELY SAFE  for most people when applied to the skin.
juniper,"Juniper, juniper berry, and juniper extract are  LIKELY SAFE  when consumed in normal food amounts."
kale,Kale is  LIKELY SAFE  when consumed in food amounts.
kamala,There isn't enough information to know if kamala is safe or what the possible side effects might be.
kaolin,Kaolin is  POSSIBLY SAFE  for most people when taken by mouth.
karaya-gum,Karaya gum seems safe for most people when taken with plenty of fluids.
kava,Kava is  POSSIBLY UNSAFE  when taken by mouth.
kefir,Kefir is  POSSIBLY SAFE  for most adults when taken by mouth for up to 8 weeks.
khat,Khat is  POSSIBLY UNSAFE  for most people when taken by mouth.
khella,Khella is  POSSIBLY UNSAFE  when taken in high doses or used for a long time.
kinetin,There is not enough information available to know if kinetin is safe.
kiwi,Kiwi is  LIKELY SAFE  for most people when used in food amounts.
knotweed,"Knotweed may be safe for most people, but the possible side effects of knotweed are not known."
kohlrabi,Kohlrabi is  LIKELY SAFE  when consumed in food amounts.
kombucha,Kombucha is  POSSIBLY SAFE  for most adults when taken by mouth.
korean-pine,There isn't enough information to know if Korean pine is safe.
kousso,Kousso is  LIKELY UNSAFE.
kratom,Kratom is  POSSIBLY UNSAFE  for most people when taken by mouth.
krebiozen,It isn’t known if Krebiozen is safe.
krill-oil,Krill oil is  POSSIBLY SAFE  for most adults when used appropriately for a short amount of time (up to three months).
kudzu,Kudzu is  POSSIBLY SAFE  for most people when taken by mouth appropriately for up to 4 months or when injected intravenously (by IV) for up to 20 days.
labdanum,Labdanum is  LIKELY SAFE  when taken by mouth in food amounts.
labrador-tea,Labrador tea is  POSSIBLY SAFE  for most people when used as a weak tea or in small amounts.
laburnum,Laburnum is  UNSAFE.
lactase,Lactase seems to be safe for most people.
lactobacillus,Lactobacillus is  LIKELY SAFE  when taken by mouth appropriately.
lactoferrin,Lactoferrin is safe in amounts consumed in food.
lady-fern,There isn’t enough information to know if lady fern is safe or what the potential side effects might be.
ladys-bedstraw,It is not known if lady's bedstraw is safe or what the possible side effects might be.
laminaria,Laminaria is  LIKELY SAFE  when it is consumed in amounts found in food.
larch-arabinogalactan,Larch arabinogalactan is  LIKELY SAFE  when eaten in food amounts.
larch-turpentine,Larch turpentine seems safe when used on unbroken skin.
l-arginine,"L-arginine is  POSSIBLY SAFE  for most people when taken appropriately by mouth, administered as a shot, applied to the skin, used in a toothpaste, or inhaled, short-term."
lathyrus,Lathyrus is  LIKELY UNSAFE  when taken by  mouth.
laurelwood,There isn't enough information to know if laurelwood is safe.
lauric-acid,Lauric acid is safe in amounts found in foods.
lavender,Lavender is  LIKELY SAFE  for most adults in food amounts.
lavender-cotton,There isn't enough information available to know if lavender cotton is safe.
l-carnitine,"L-carnitine is  LIKELY SAFE  when taken by mouth for up to 12 months, and when used as an injection, with the approval of a healthcare provider."
l-citrulline,L-citrulline is  POSSIBLY SAFE  when used orally and appropriately by adults.
lecithin,Lecithin is  LIKELY SAFE  for most people.
lemon,Lemon is  LIKELY SAFE  in the amounts typically found in foods.
lemon-balm,Lemon balm is  LIKELY SAFE  when used in food amounts.
lemon-eucalyptus,Lemon eucalyptus oil is safe for most adults when applied to the skin as a mosquito repellent.
lemon-verbena,Lemon verbena is safe for most people when consumed in amounts found in  alcoholic  beverages.
lemongrass,Lemongrass is  LIKELY SAFE  for most people when used in food amounts.
lentinan,There isn't enough information available to know if lentinan is safe.
lesser-celandine,Eating small amounts of fresh leaf sheaths of lesser celandine is  POSSIBLY SAFE.
levant-berry,Levant berry is  UNSAFE  to take by  mouth.
licorice,Licorice is  LIKELY SAFE  for most people when taken by mouth in amounts found in foods.
lily-of-the-valley,Lily-of-the-valley might be safe for most people when used under proper medical supervision.
lime,Lime is  LIKELY SAFE  for most adults when used in amounts found in foods.
limonene,Limonene is safe in food amounts.
linden,Linden is  LIKELY SAFE  for most people when the leaf is used in food amounts.
lingonberry,Lingonberry concentrate is  POSSIBLY SAFE  when taken by  mouth  appropriately.
lipase,Lipase seems to be safe for most people.
lithium,Lithium seems to be safe for most people when taken appropriately with careful monitoring by a healthcare provider.
liver-extract,There isn't enough information to know if liver extract is safe.
liverwort,Fresh liverwort is  LIKELY UNSAFE  when taken by mouth or applied to the skin.
lobelia,Lobelia is considered  LIKELY UNSAFE  for most people when taken by mouth.
logwood,It isn’t known if logwood is safe or what the possible side effects might be.
loosestrife,There isn't enough information to know if loosestrife is safe or what the possible side effects might be.
lorenzos-oil,Lorenzo’s oil seems to be safe when used under the care of health professionals.
lotus,There is not enough known about lotus to know if it is safe.
lousewort,It isn't known if lousewort is safe or what the possible side effects might be.
lovage,Lovage is  POSSIBLY SAFE  for most people.
l-tryptophan,L-tryptophan is  POSSIBLY UNSAFE  when taken by mouth as a medicine.
luffa,Luffa is  LIKELY SAFE  for most people when applied directly to the skin as a sponge.
lungmoss,It isn’t known if lungmoss is safe or what the possible side effects might be.
lungwort,It is not known if lungwort is safe or what the potential side effects might be.
lutein,Lutein is  LIKELY SAFE  when taken by mouth appropriately.
lychee,It isn't known if lychee is safe.
lycopene,Lycopene is  LIKELY SAFE  when taken by mouth in appropriate amounts.
lysine,"Lysine is  POSSIBLY SAFE  for most people when taken by mouth at recommended doses for up to one year, or when applied to the skin short-term."
maca,Maca is  LIKELY SAFE  for most people when taken in amounts found in foods.
macadamia-nut,"Macadamia nuts are safe as food, and they seem to be safe as medicine for most people."
mace,"Mace is  POSSIBLY SAFE 
when taken by mouth and used appropriately."
madagascar-periwinkle,Madagascar periwinkle is  UNSAFE  when taken by mouth due to the presence of poisonous chemicals known as vinca alkaloids.
madder,Madder is considered  LIKELY UNSAFE  when taken by  mouth.
magnesium,"Magnesium is  LIKELY SAFE  for most people when taken by mouth appropriately or when the prescription-only, injectable product is used correctly."
magnolia,"Magnolia is  POSSIBLY SAFE  for most people when taken by mouth or applied as a toothpaste, short-term."
maidenhair-fern,Maidenhair fern might be safe for most people when taken in the small amounts found in foods.
maitake-mushroom,"Maitake mushroom is  POSSIBLY SAFE  for most people when taken by mouth as medicine, but there isn't much information about the potential side effects."
malabar-nut,It is not known if Malabar nut is safe or what the possible side effects might be.
male-fern,Male fern is  UNSAFE.
malic-acid,Malic acid is  LIKELY SAFE  when taken by mouth in food amounts.
mallow,There isn't enough reliable information available about mallow to know if it is safe to use.
manaca,There isn't enough information to know if manaca is safe for people to use.
manchurian-thorn,It isn't known if Manchurian thorn is safe.
manganese,Manganese is  LIKELY SAFE  for most adults when taken by mouth in amounts up to 11 mg per day.
mangosteen,There is not enough reliable information to know if mangosteen products are safe for use as medicines.
manna,"Manna appears safe for most people, when used short-term."
maqui,There is not enough information to know if maqui is safe.
maral-root,It isn’t known if maral root is safe.
marijuana,"Marijuana extract is  POSSIBLY SAFE  when used as a specific spray (Sativex, GW Pharmaceuticals) that is applied under the tongue."
maritime-pine,"A standardized extract of maritime pine bark (Pycnogenol, Horphag Research) is  POSSIBLY SAFE  when taken by mouth in doses of 50 mg to 450 mg daily for up to one year, and when applied to the skin as a cream for up to 7 days or as a powder for up to 6 weeks."
marjoram,Marjoram is  LIKELY SAFE  in food amounts and  POSSIBLY SAFE  for most adults when taken by mouth in medicinal amounts for short periods of time.
marsh-blazing-star,There isn't enough information to know if marsh blazing star is safe.
marsh-marigold,Fresh marsh marigold is  UNSAFE.
marsh-tea,Marsh tea is  UNSAFE  when taken in large amounts to try to cause abortion.
marshmallow,Marshmallow is  LIKELY SAFE  for most people when taken by mouth.
martagon,There isn't enough information to know if martagon is safe or what the possible side effects might be.
masterwort,Masterwort is  POSSIBLY UNSAFE  when taken by  mouth  or applied to the  skin.
mastic,Mastic is  POSSIBLY SAFE  for most people when taken appropriately by mouth.
meadowsweet,"Meadowsweet, when taken appropriately, might be safe for most people."
mediterranean-diet,.
medium-chain-triglycerides-mcts,MCTs are safe for most people when taken by mouth or given intravenously (by IV).
melanotan-ii,Melanotan-II is  POSSIBLY SAFE  when used under medical supervision for  treating ED  ( erectile dysfunction ).
melatonin,"Melatonin is  LIKELY SAFE  for most adults when taken by mouth or injected into the body short-term, or when applied directly  to the skin."
mentzelia,There isn't enough information to know if mentzelia is safe or what the possible side effects might be.
mercury-herb,Mercury herb is  UNSAFE  when the fresh plant is taken by  mouth.
mesoglycan,Mesoglycan is  POSSIBLY SAFE  for most adults when taken by mouth.
methionine,Methionine is  LIKELY SAFE  when taken by mouth in amounts commonly found in foods.
methoxylated-flavones,Methoxylated flavones are a normal part of the diet. They are safe when consumed as part of food.
methylpentane,Taking methylpentane by  mouth  is  POSSIBLY UNSAFE.
mexican-scammony-root,There isn’t enough reliable information to know whether Mexican scammony root is safe.
mezereon,Mezereon is  UNSAFE  when taken by  mouth.
mgn-3,There isn’t enough reliable information to know whether MGN-3 is safe.
milk-thistle,Milk thistle extract is  LIKELY SAFE  when taken by mouth for most adults.
miracle-fruit,There isn't enough information available to know if miracle fruit is safe.
molybdenum,Molybdenum is  LIKELY SAFE  when taken by  mouth  appropriately by adults.
moneywort,There isn't enough information to know if moneywort might be safe.
monolaurin,Monolaurin is safe for most people when used in amounts commonly found in foods.
moringa,Moringa is POSSIBLY SAFE when taken by mouth and used appropriately.
mormon-tea,Mormon tea seems to be safe when consumed as a beverage in normal food amounts.
motherwort,Motherwort is  POSSIBLY SAFE  for most people when taken by mouth appropriately.
mountain-ash,Fresh mountain ash berries are  UNSAFE.
mountain-flax,"Mountain flax might be  UNSAFE  for some people, especially with long-term use."
mountain-laurel,Mountain laurel is  UNSAFE  for people to take by  mouth.
mouse-ear,There isn't enough information to know if mouse ear is safe.
msm-methylsulfonylmethane,"MSM is  POSSIBLY SAFE  for most people when taken by mouth for up to 3 months or when applied to the skin in combination with other ingredients, such as silymarin or hyaluronic acid and tea tree oil, for up to 20 days."
mugwort,There isn't enough information to know if mugwort is safe.
muira-puama,It is not known if muira puama is safe or what the possible side effects might be.
mullein,"Mullein is  POSSIBLY SAFE  when applied directly to the ear, short-term."
musk,There isn't enough information to know if musk is safe to use as a medicine.
myrcia,There isn't enough reliable information available about Myrcia to know if it is safe.
myrrh,Myrrh seems safe for most people when used in small amounts.
myrtle,The oil of myrtle is  UNSAFE.
n-acetyl-cysteine,"N-acetyl cysteine is  LIKELY SAFE  for most adults, when used as a prescription medication."
n-acetyl-glucosamine,"N-acetyl glucosamine is  POSSIBLY SAFE  when taken by mouth in doses of 3-6 grams daily, when applied to the skin, or when used rectally in doses of 3-4 grams daily."
nadh,"NADH seems safe for most people when used appropriately and short-term, up to 12 weeks."
nasturtium,Nasturtium might be safe for adults when applied directly to the skin in combination with other natural medicines.
nattokinase,Nattokinase is  LIKELY SAFE  when taken by mouth in amounts commonly found in foods.
neem,"Neem bark extract is  POSSIBLY SAFE  for most adults when taken by mouth, short-term."
nerve-root,Nerve root is  POSSIBLY UNSAFE  for most people when taken by  mouth.
new-jersey-tea,New Jersey tea might be safe for most people.
new-zealand-green-lipped-mussel,New Zealand green-lipped mussel is  POSSIBLY SAFE for most people when taken by mouth.
niacin-and-niacinamide-vitamin-b3,Niacin is  LIKELY SAFE  for most people when taken by mouth.
niacinamide,Niacinamide is  LIKELY SAFE  for most adults when taken by mouth.
niauli-oil,Niauli oil might be safe for most adults when taken by  mouth.
nickel,Nickel is  LIKELY SAFE  for most adults when taken by  mouth  in amounts up to 1 mg/day.
nikko-maple,It is not known if nikko maple is safe or what the possible side effects might be.
noni,Noni is  POSSIBLY SAFE  when the fruit is consumed as food.
northern-prickly-ash,"Northern prickly ash bark might be safe for most people, but the potential side effects are not known."
nutmeg-and-mace,Nutmeg and mace are  POSSIBLY SAFE  when taken by  mouth  and used appropriately.
nux-vomica,Nux vomica is  UNSAFE.
oak-moss,Oak moss might be safe for most people when taken for short periods of time as a water-based tea.
oats,"Oat bran is  LIKELY SAFE  for most people, including pregnant and breast-feeding women."
octacosanol,There is not enough information to know if octacosanol is safe.
octodrine,Octodrine is  POSSIBLY UNSAFE  when taken by mouth.
oleander,Injecting a specific oleander product (Anvirzel) into the muscle is  POSSIBLY SAFE  when administered by a healthcare professional for up to 3 weeks.
olive,Olive oil is  LIKELY SAFE  when taken appropriately by mouth or applied to the skin.
omega-6-fatty-acids,Omega-6 fatty acids are  LIKELY SAFE  when consumed by adults and children over the age of 12 months as part of the diet in amounts between 5% and 10% of  daily calories.
onion,Onion is  LIKELY SAFE  when taken by mouth in amounts commonly found in food or when onion extract is applied to the skin.
oolong-tea,Drinking moderate amounts of oolong tea is  LIKELY SAFE  for most adults.
opium-antidote,There isn't enough information available to know if opium antidote is safe.
orchic-extract,There isn't enough reliable information to know if orchic extract is safe.
oregano,Oregano leaf is  LIKELY SAFE  when taken in the amounts found in food and  POSSIBLY SAFE  when taken by mouth or applied to the skin in medicinal amounts.
oregon-fir-balsam,There isn't enough information to know if Oregon fir balsam is safe or what the possible side effects might be.
oregon-grape,Oregon grape cream is  POSSIBLY SAFE  for most people when applied directly to the skin.
